<?xml version="1.0" encoding="UTF-8"?>
<!--  Input XML document. This XML is valid against Test.xsd XML schema-->

<p7:Medicines xmlns:xsi="http://www.w3.org/2001/XMLSchema-instance"
         xmlns:p7="http://nure.ua/chernykh/practice7"
         xsi:schemaLocation="http://nure.ua/chernykh/practice7 input.xsd">

    <Medicine>
        <MedicineName>Болеуталяющее1</MedicineName>
        <MedicineGroup>Болеуталяющие</MedicineGroup>
        <MedicinePharm>Pharm1</MedicinePharm>
        <MedicineAnalog>БолеуталяющееАналог1</MedicineAnalog>
        <MedicineAnalog>БолеуталяющееАналог2</MedicineAnalog>
        <MedicineAnalog>БолеуталяющееАналог3</MedicineAnalog>
        <MedicineVersion>
            <MedicineVersionName>Капсулы</MedicineVersionName>
            <PharmVersion>
                <PharmName>Pharm1</PharmName>
                <PharmCertificate>
                    <CertificateNumber>111</CertificateNumber>
                    <CertificateStartDate>2019-06-06</CertificateStartDate>
                    <CertificateEndDate>2020-06-06</CertificateEndDate>
                    <CertificateOrganisation>Org1</CertificateOrganisation>
                </PharmCertificate>
                <MedicinePackage>
                    <PackageType>PackageType1</PackageType>
                    <MedicineAmount>10</MedicineAmount>
                    <MedicinePrice>9.99</MedicinePrice>
                </MedicinePackage>
                <MedicineDosage>
                    <DoseAmount>1</DoseAmount>
                    <DosagePeriodicity periodicityType="daily">3</DosagePeriodicity>
                </MedicineDosage>
            </PharmVersion>
        </MedicineVersion>
        <MedicineVersion>
            <MedicineVersionName>Таблетки</MedicineVersionName>
            <PharmVersion>
                <PharmName>Pharm1</PharmName>
                <PharmCertificate>
                    <CertificateNumber>222</CertificateNumber>
                    <CertificateStartDate>2019-06-06</CertificateStartDate>
                    <CertificateEndDate>2021-06-06</CertificateEndDate>
                    <CertificateOrganisation>Org2</CertificateOrganisation>
                </PharmCertificate>
                <MedicinePackage>
                    <PackageType>PackageType2</PackageType>
                    <MedicineAmount>20</MedicineAmount>
                    <MedicinePrice>7.88</MedicinePrice>
                </MedicinePackage>
                <MedicineDosage>
                    <DoseAmount>1</DoseAmount>
                    <DosagePeriodicity periodicityType="daily">3</DosagePeriodicity>
                </MedicineDosage>
            </PharmVersion>
        </MedicineVersion>
        <MedicineVersion>
            <MedicineVersionName>Порошок</MedicineVersionName>
            <PharmVersion>
                <PharmName>Pharm2</PharmName>
                <PharmCertificate>
                    <CertificateNumber>333</CertificateNumber>
                    <CertificateStartDate>2019-06-06</CertificateStartDate>
                    <CertificateEndDate>2019-12-06</CertificateEndDate>
                    <CertificateOrganisation>Org3</CertificateOrganisation>
                </PharmCertificate>
                <MedicinePackage>
                    <PackageType>PackageType3</PackageType>
                    <MedicineAmount>9</MedicineAmount>
                    <MedicinePrice>14.55</MedicinePrice>
                </MedicinePackage>
                <MedicineDosage>
                    <DoseAmount>1</DoseAmount>
                    <DosagePeriodicity periodicityType="daily">2</DosagePeriodicity>
                </MedicineDosage>
            </PharmVersion>
        </MedicineVersion>
    </Medicine>

    <Medicine>
        <MedicineName>Антибиотик1</MedicineName>
        <MedicineGroup>Антибиотики</MedicineGroup>
        <MedicinePharm>Pharm2</MedicinePharm>
<!--        <MedicineAnalogs>АнтибиотикАналог1</MedicineAnalogs>-->
<!--        <MedicineAnalogs>АнтибиотикАналог2</MedicineAnalogs>-->
<!--        <MedicineAnalogs>АнтибиотикАналог3</MedicineAnalogs>-->
        <MedicineVersion>
            <MedicineVersionName>Капсулы</MedicineVersionName>
            <PharmVersion>
                <PharmName>Pharm21</PharmName>
                <PharmCertificate>
                    <CertificateNumber>444</CertificateNumber>
                    <CertificateStartDate>2019-06-06</CertificateStartDate>
                    <CertificateEndDate>2019-12-06</CertificateEndDate>
                    <CertificateOrganisation>Org4</CertificateOrganisation>
                </PharmCertificate>
                <MedicinePackage>
                    <PackageType>PackageType1</PackageType>
                    <MedicineAmount>10</MedicineAmount>
                    <MedicinePrice>49.99</MedicinePrice>
                </MedicinePackage>
                <MedicineDosage>
                    <DoseAmount>1</DoseAmount>
                    <DosagePeriodicity periodicityType="daily">1</DosagePeriodicity>
                </MedicineDosage>
            </PharmVersion>
            <PharmVersion>
                <PharmName>Pharm22</PharmName>
                <PharmCertificate>
                    <CertificateNumber>666</CertificateNumber>
                    <CertificateStartDate>2019-06-06</CertificateStartDate>
                    <CertificateEndDate>2019-06-06</CertificateEndDate>
                    <CertificateOrganisation>Org5</CertificateOrganisation>
                </PharmCertificate>
                <MedicinePackage>
                    <PackageType>PackageType1</PackageType>
                    <MedicineAmount>12</MedicineAmount>
                    <MedicinePrice>74.99</MedicinePrice>
                </MedicinePackage>
                <MedicineDosage>
                    <DoseAmount>1</DoseAmount>
                    <DosagePeriodicity periodicityType="daily">1</DosagePeriodicity>
                </MedicineDosage>
            </PharmVersion>
        </MedicineVersion>
        <MedicineVersion>
            <MedicineVersionName>Таблетки</MedicineVersionName>
            <PharmVersion>
                <PharmName>Pharm21</PharmName>
                <PharmCertificate>
                    <CertificateNumber>555</CertificateNumber>
                    <CertificateStartDate>2019-06-06</CertificateStartDate>
                    <CertificateEndDate>2020-06-06</CertificateEndDate>
                    <CertificateOrganisation>Org4</CertificateOrganisation>
                </PharmCertificate>
                <MedicinePackage>
                    <PackageType>PackageType2</PackageType>
                    <MedicineAmount>20</MedicineAmount>
                    <MedicinePrice>37.88</MedicinePrice>
                </MedicinePackage>
                <MedicineDosage>
                    <DoseAmount>1</DoseAmount>
                    <DosagePeriodicity periodicityType="daily">2</DosagePeriodicity>
                </MedicineDosage>
            </PharmVersion>
            <PharmVersion>
                <PharmName>Pharm22</PharmName>
                <PharmCertificate>
                    <CertificateNumber>777</CertificateNumber>
                    <CertificateStartDate>2019-06-06</CertificateStartDate>
                    <CertificateEndDate>2021-06-06</CertificateEndDate>
                    <CertificateOrganisation>Org4</CertificateOrganisation>
                </PharmCertificate>
                <MedicinePackage>
                    <PackageType>PackageType2</PackageType>
                    <MedicineAmount>50</MedicineAmount>
                    <MedicinePrice>98.88</MedicinePrice>
                </MedicinePackage>
                <MedicineDosage>
                    <DoseAmount>1</DoseAmount>
                    <DosagePeriodicity periodicityType="daily">3</DosagePeriodicity>
                </MedicineDosage>
            </PharmVersion>
        </MedicineVersion>
    </Medicine>

    <Medicine>
        <MedicineName>ВитаминА</MedicineName>
        <MedicineGroup>Витамины</MedicineGroup>
        <MedicinePharm>Pharm3</MedicinePharm>
        <MedicineAnalog>ВитаминАналог1</MedicineAnalog>
        <MedicineAnalog>ВитаминАналог2</MedicineAnalog>
        <MedicineAnalog>ВитаминАналог3</MedicineAnalog>
        <MedicineVersion>
            <MedicineVersionName>Капсулы</MedicineVersionName>
            <PharmVersion>
                <PharmName>Pharm33</PharmName>
                <PharmCertificate>
                    <CertificateNumber>1111</CertificateNumber>
                    <CertificateStartDate>2019-06-06</CertificateStartDate>
                    <CertificateEndDate>2020-06-06</CertificateEndDate>
                    <CertificateOrganisation>Org33</CertificateOrganisation>
                </PharmCertificate>
                <MedicinePackage>
                    <PackageType>PackageType1</PackageType>
                    <MedicineAmount>20</MedicineAmount>
                    <MedicinePrice>19.99</MedicinePrice>
                </MedicinePackage>
                <MedicineDosage>
                    <DoseAmount>1</DoseAmount>
                    <DosagePeriodicity periodicityType="daily">3</DosagePeriodicity>
                </MedicineDosage>
            </PharmVersion>
        </MedicineVersion>
        <MedicineVersion>
            <MedicineVersionName>Таблетки</MedicineVersionName>
            <PharmVersion>
                <PharmName>Pharm33</PharmName>
                <PharmCertificate>
                    <CertificateNumber>2222</CertificateNumber>
                    <CertificateStartDate>2019-06-06</CertificateStartDate>
                    <CertificateEndDate>2021-06-06</CertificateEndDate>
                    <CertificateOrganisation>Org22</CertificateOrganisation>